{
  "id": "TS-MIX-066",
  "title": "Replace deeply mixed strings",
  "domain": "typescript",
  "topic": "advanced-mixed",
  "difficulty": "hard",
  "topics": [
    "recursive-types",
    "conditional-types",
    "mapped-types",
    "infer"
  ],
  "estimatedMinutes": 10,
  "prerequisites": [
    "generics",
    "mapped-types",
    "conditional-types",
    "infer",
    "template-literal-types"
  ],
  "hints": [
    "Separate the input into the structural cases that produce different outputs.",
    "Combine conditional inference with mapping, remapping, indexed access, or recursion as required.",
    "Preserve the correlation between each source member, key, payload, and resulting branch."
  ],
  "validation": {
    "type": "typescript"
  }
}
