{
  "id": "TS-OPS-040",
  "title": "Derive grid cell literals",
  "domain": "typescript",
  "topic": "type-operators",
  "difficulty": "hard",
  "topics": [
    "const-assertions",
    "typeof",
    "indexed-access",
    "nested-arrays"
  ],
  "estimatedMinutes": 10,
  "prerequisites": [
    "const-assertions",
    "indexed-access",
    "arrays"
  ],
  "hints": [
    "One numeric index removes the outer tuple layer.",
    "A second numeric index removes the row layer.",
    "Preserve literals first, then apply both indices."
  ],
  "validation": {
    "type": "typescript"
  }
}
