{
  "id": "TS-CORE-002",
  "title": "Update readonly configuration",
  "domain": "typescript",
  "topic": "core",
  "difficulty": "medium",
  "topics": ["readonly", "object-types", "immutability"],
  "estimatedMinutes": 5,
  "prerequisites": ["object-types"],
  "hints": [
    "Readonly prevents mutation; it does not prevent creating a changed copy.",
    "Object spread can preserve existing properties in a new value.",
    "Create a new object from the configuration and override only the retry count."
  ],
  "validation": { "type": "typescript" }
}
