{
  "id": "TS-REC-047",
  "title": "Remove function properties recursively",
  "domain": "typescript",
  "topic": "recursive-types",
  "difficulty": "hard",
  "topics": [
    "recursive-types",
    "mapped-types",
    "key-remapping",
    "functions"
  ],
  "estimatedMinutes": 10,
  "prerequisites": [
    "conditional-types",
    "mapped-types"
  ],
  "hints": [
    "Identify the non-recursive base case for function-valued key filtering before recursion into data properties.",
    "Use a conditional or mapped type to reduce the input before the recursive reference.",
    "Ensure every recursive step consumes a layer, tuple member, string segment, or depth unit."
  ],
  "validation": {
    "type": "typescript"
  }
}
